[
  {
    "schema_version": "4.0",
    "family_id": "fam-authored-order-csv",
    "name": "人工订单CSV开发流程",
    "grouping_basis": "Conservative single authored development source; no independent research family claim",
    "source_ids": [
      "src-authored-order-csv"
    ],
    "review_status": "pending",
    "review_note": "Not eligible for formal heldout; future sources require independent grouping review"
  }
]
